{
  "packet_id": "P011-CP-OMNI-2026-08-22",
  "packet_version": "v0.4",
  "supersedes_packet": null,
  "status": "under_review",
  "created_at": "2026-08-22T18:45:00Z",
  "session_start": null,
  "session_end": null,
  "human_owner": "Charles Earl Lipshay",
  "responsible_reviewer": "Charles Earl Lipshay",
  "privacy_class": "public",
  "project_hierarchy": {
    "prompt_stack": "Prompt #11",
    "canonical_module": "P-011-OMNI-001",
    "program": "Omni-Device Multi-AI Learning and Business Continuity",
    "workstream": "Current Checkpoint and Mobile Session Routine",
    "work_packet": "WP-OMNI-0002",
    "pilot_or_product_id": "OMNI-PILOT-001",
    "ceiu_id": "CEIU-LK9-QUANTUM-INNOVATION-001",
    "franchise_node": null
  },
  "session_environment": {
    "device": "iphone",
    "device_detail": "User-directed continuation from iPhone with GitHub-connected implementation",
    "platform": "chatgpt_business",
    "platform_detail": "ChatGPT Business and GitHub",
    "model_line": "chatgpt",
    "connectivity": "online",
    "account_or_workspace_label": "lippytm.AI"
  },
  "objective": {
    "session_objective": "Create the authoritative Current Checkpoint, mobile and platform session checklists, and offline conflict and recovery procedure for Prompt #11.",
    "in_scope": [
      "Current Checkpoint pointer",
      "versioned Continuation Packet",
      "iPhone, iPad, ASUS laptop and Zo checklists",
      "ChatGPT, Gemini/NotebookLM, Claude/Hermes, GitHub and Slack checklists",
      "offline, synchronization, conflict, backup and recovery procedures",
      "open GitHub work packets for device safety, the $7 ledger and the first OMNI pilot"
    ],
    "out_of_scope": [
      "recording passwords, private keys or recovery codes",
      "claiming live platform synchronization",
      "deploying Zo services or external automations",
      "creating private NotebookLM or Claude workspaces",
      "publishing or minting a commercial product",
      "passing HumanApprovalGate on behalf of the human owner"
    ],
    "acceptance_criteria": [
      "One file identifies the current project state and exact next action",
      "The packet can be used from a new authorized session without hidden chat context",
      "Device and platform checklists preserve privacy, security and model-line identity",
      "Offline and conflicting work can be reconciled without silent overwrite",
      "The packet clearly distinguishes review-ready from human-approved state"
    ]
  },
  "work_completed": [
    {
      "summary": "Merged P-011-OMNI-001 into Prompt #11 main through pull request #7.",
      "status": "completed",
      "evidence_reference": "merge commit 736fb358c7025921aa041f08281af0731f7b3492"
    },
    {
      "summary": "Created the Continuation directory operating rules.",
      "status": "completed",
      "evidence_reference": "continuation/README.md"
    },
    {
      "summary": "Created the Current Checkpoint pointer.",
      "status": "completed",
      "evidence_reference": "continuation/CURRENT.md"
    },
    {
      "summary": "Created device and platform session checklists.",
      "status": "completed",
      "evidence_reference": "docs/P011-OMNI-001-mobile-session-checklists.md"
    },
    {
      "summary": "Created offline, synchronization, conflict and recovery procedures.",
      "status": "completed",
      "evidence_reference": "docs/P011-OMNI-001-offline-conflict-recovery-procedure.md"
    },
    {
      "summary": "Opened executable work-packet issues for the Current Checkpoint, device inventory, ledger data model, ledger prototype and first mobile learning pilot.",
      "status": "completed",
      "evidence_reference": "Prompt #11 issues #8 through #12"
    },
    {
      "summary": "Create and merge the WP-OMNI-0002 pull request.",
      "status": "not_started",
      "evidence_reference": null
    },
    {
      "summary": "Obtain human review or approval for this packet and record the scope.",
      "status": "not_started",
      "evidence_reference": null
    }
  ],
  "decisions": [
    {
      "decision_id": "DEC-OMNI-0004",
      "decision": "The Current Checkpoint may point to a review-ready packet but must visibly state when HumanApprovalGate is pending.",
      "rationale": "The project needs a usable resume point without misrepresenting an AI-created or unreviewed record as human-approved.",
      "evidence_or_source": "continuation/CURRENT.md",
      "human_approver": null,
      "reversible": true
    },
    {
      "decision_id": "DEC-OMNI-0005",
      "decision": "GitHub issues #8 through #12 are the current executable work definitions.",
      "rationale": "Issues preserve acceptance criteria, dependencies and durable work references across devices and sessions.",
      "evidence_or_source": "Prompt #11 issues #8, #9, #10, #11 and #12",
      "human_approver": null,
      "reversible": true
    },
    {
      "decision_id": "DEC-OMNI-0006",
      "decision": "Slack notifications must link to canonical records and cannot independently pass HumanApprovalGate.",
      "rationale": "Collaboration messages are useful but may be incomplete, informal or separated from the approved artifact and scope.",
      "evidence_or_source": "docs/P011-OMNI-001-mobile-session-checklists.md",
      "human_approver": null,
      "reversible": true
    }
  ],
  "artifacts": [
    {
      "artifact_id": "ART-OMNI-CURRENT-README-001",
      "title_or_path": "continuation/README.md",
      "artifact_type": "operating_rules",
      "version": "0.4.0",
      "location": "lippytm/Prompt-11- feature/wp-omni-0002-current-checkpoint",
      "status": "under_review",
      "privacy_class": "public",
      "content_hash": null
    },
    {
      "artifact_id": "ART-OMNI-CURRENT-POINTER-001",
      "title_or_path": "continuation/CURRENT.md",
      "artifact_type": "current_checkpoint_pointer",
      "version": "0.4.0",
      "location": "lippytm/Prompt-11- feature/wp-omni-0002-current-checkpoint",
      "status": "under_review",
      "privacy_class": "public",
      "content_hash": null
    },
    {
      "artifact_id": "ART-OMNI-CURRENT-PACKET-001",
      "title_or_path": "continuation/P011-CP-OMNI-2026-08-22-v0.4.json",
      "artifact_type": "continuation_packet",
      "version": "0.4.0",
      "location": "lippytm/Prompt-11- feature/wp-omni-0002-current-checkpoint",
      "status": "under_review",
      "privacy_class": "public",
      "content_hash": null
    },
    {
      "artifact_id": "ART-OMNI-CHECKLISTS-001",
      "title_or_path": "docs/P011-OMNI-001-mobile-session-checklists.md",
      "artifact_type": "operating_checklists",
      "version": "0.4.0",
      "location": "lippytm/Prompt-11- feature/wp-omni-0002-current-checkpoint",
      "status": "under_review",
      "privacy_class": "public",
      "content_hash": null
    },
    {
      "artifact_id": "ART-OMNI-RECOVERY-001",
      "title_or_path": "docs/P011-OMNI-001-offline-conflict-recovery-procedure.md",
      "artifact_type": "recovery_procedure",
      "version": "0.4.0",
      "location": "lippytm/Prompt-11- feature/wp-omni-0002-current-checkpoint",
      "status": "under_review",
      "privacy_class": "public",
      "content_hash": null
    }
  ],
  "system_references": {
    "repository": "lippytm/Prompt-11-",
    "branch": "feature/wp-omni-0002-current-checkpoint",
    "commits": [
      "736fb358c7025921aa041f08281af0731f7b3492",
      "eb9313805e5009181a84018e0529e1520d4cd0c3",
      "dfd864b9e5c646456b6b9642d4aa41e28d32ba61",
      "88b2ba92652e4849bde6fa620e0f3fcfe125eb21",
      "ef2f19b9db8c27e44fabe33d593bf4880829aa2e"
    ],
    "pull_request": null,
    "issues": [8, 9, 10, 11, 12],
    "release_or_tag": null,
    "slack_reference": null,
    "notebook_reference": null,
    "zo_reference": null,
    "other_authoritative_reference": "P-011-OMNI-001 merged through Prompt #11 PR #7"
  },
  "claims": [
    {
      "claim_id": "CLM-OMNI-0003",
      "summary": "P-011-OMNI-001 was merged into the Prompt #11 main branch through pull request #7.",
      "truth_label": "VF",
      "source_ids": ["GITHUB-PR-7", "GITHUB-MERGE-736FB358"],
      "date_verified": "2026-08-22",
      "contradictions": [],
      "publication_status": "publication_safe"
    },
    {
      "claim_id": "CLM-OMNI-0004",
      "summary": "The named external platforms are part of the architecture, but live synchronization and connector deployment remain unverified unless separately tested.",
      "truth_label": "VF",
      "source_ids": ["P011-OMNI-001-COMPLETION-BOUNDARY"],
      "date_verified": "2026-08-22",
      "contradictions": [],
      "publication_status": "publication_safe"
    },
    {
      "claim_id": "CLM-OMNI-0005",
      "summary": "This packet is review-ready and not yet human-approved.",
      "truth_label": "VF",
      "source_ids": ["PACKET-STATUS-UNDER-REVIEW"],
      "date_verified": "2026-08-22",
      "contradictions": [],
      "publication_status": "publication_safe"
    }
  ],
  "quality_status": {
    "certification_level": "Q2",
    "node_level": null,
    "risk_gate": "yellow",
    "quality_score": null,
    "tests_completed": [
      "Current Checkpoint completeness review",
      "Cross-device role review",
      "Privacy and restricted-data boundary review",
      "Offline conflict category review",
      "Issue dependency cross-check"
    ],
    "tests_failed": [],
    "critical_defects": [],
    "noncritical_defects": [
      "Continuation Packet schema is not yet enforced by CI",
      "Device and account inventory evidence remains incomplete",
      "External connector permission and functional tests remain incomplete",
      "Human approval remains pending"
    ],
    "required_reviewers": [
      "Human owner",
      "Security reviewer before connector deployment",
      "Accessibility reviewer before learner release"
    ],
    "gate_status": [
      {
        "gate": "ContinuationGate",